{
  "version": 1,
  "mode": "SPEC_ONLY",
  "project": {
    "name": "order-inventory-design-example",
    "database": "MYSQL"
  },
  "requirements": {
    "REQ-ORDER-PLACE": {
      "title": "주문 생성과 재고 차감",
      "source": {
        "document": "order-inventory.definition.md",
        "version": "sample-v1",
        "section": "정상 처리와 불변 규칙",
        "excerpt": "재고는 음수가 될 수 없으며 주문 저장과 재고 차감은 함께 성공하거나 롤백된다."
      },
      "domain": {
        "owner": "Order application service",
        "aggregates": [
          "Order",
          "Inventory"
        ],
        "dataOwnership": [
          "Order 도메인이 주문 데이터를 소유한다.",
          "Inventory 도메인이 재고 수량을 소유한다."
        ],
        "allowedDependencies": [
          "주문 application service는 Inventory의 공개 재고 차감 기능을 호출할 수 있다."
        ],
        "entryPoints": [
          "주문 생성 요청 (진입점 구현 방식은 아직 미정)"
        ]
      },
      "preconditions": [
        "주문 수량은 양수이다.",
        "동일 tenant와 orderId가 비즈니스 키이다."
      ],
      "postconditions": [
        "주문 1건이 저장되고 해당 수량만큼 재고가 감소한다."
      ],
      "invariants": [
        "재고 수량은 0 이상이다.",
        "동일 tenant/orderId의 주문과 재고 차감은 한 번만 반영된다."
      ],
      "coreLogic": [
        "입력과 주문 키를 확인한다.",
        "주문 저장과 재고 차감을 하나의 원자적 업무로 처리한다.",
        "성공한 동일 키의 재처리는 최초 결과를 반환한다."
      ],
      "transaction": {
        "applicability": "APPLICABLE",
        "reason": "같은 MySQL DB의 주문 저장과 재고 차감은 하나의 업무 단위이다.",
        "expectations": [
          "주문과 재고 변경은 함께 commit되거나 함께 rollback된다.",
          "업무 transaction 안에서 외부 변경 호출을 하지 않는다."
        ]
      },
      "concurrency": {
        "applicability": "APPLICABLE",
        "reason": "같은 상품에 여러 주문이 동시에 들어올 수 있다.",
        "expectations": [
          "경합 후에도 재고는 음수가 아니다.",
          "재고가 부족한 주문은 주문/재고 변경을 남기지 않는다."
        ]
      },
      "idempotency": {
        "applicability": "APPLICABLE",
        "reason": "동일 주문 요청이 재전달될 수 있다.",
        "expectations": [
          "키는 tenantId와 orderId 조합이다.",
          "동일 입력 재처리는 추가 차감 없이 최초 결과를 반환한다.",
          "동일 키의 다른 입력은 conflict로 거부한다."
        ]
      },
      "consistency": {
        "applicability": "APPLICABLE",
        "reason": "부분 저장과 중복 차감은 허용되지 않는다.",
        "expectations": [
          "재고 차감 후 저장 실패 시 재고와 주문 모두 원래 상태이다.",
          "이미 commit된 요청의 재시도는 추가 변경을 남기지 않는다."
        ]
      },
      "scenarios": {
        "SCN-NORMAL": {
          "type": "NORMAL",
          "given": "재고 5개, 새 주문 키, 요청 수량 2개",
          "when": "주문을 처리한다.",
          "expectedOutcomes": [
            "주문은 1건이고 재고는 3개이다."
          ],
          "testTypes": [
            "DOMAIN_UNIT",
            "INTEGRATION",
            "SERVICE_E2E"
          ]
        },
        "SCN-DUPLICATE": {
          "type": "DUPLICATE",
          "given": "수량 2개의 주문이 성공했고 현재 재고는 3개이다.",
          "when": "같은 키와 입력을 다시 처리한다.",
          "expectedOutcomes": [
            "최초 결과를 반환한다.",
            "주문은 여전히 1건이고 재고는 3개이다."
          ],
          "testTypes": [
            "INTEGRATION",
            "SERVICE_E2E"
          ]
        },
        "SCN-CONCURRENCY": {
          "type": "CONCURRENCY",
          "given": "재고 1개, 서로 다른 주문 키 2개, 각 요청 수량 1개",
          "when": "두 주문이 경쟁 구간을 겹쳐 실행한다.",
          "expectedOutcomes": [
            "성공 주문은 1건이다.",
            "다른 주문은 부족 오류로 거부되고 변경을 남기지 않는다.",
            "최종 재고는 0개이다."
          ],
          "testTypes": [
            "REPOSITORY_DB",
            "INTEGRATION"
          ]
        },
        "SCN-ROLLBACK": {
          "type": "ROLLBACK",
          "given": "재고 5개, 새 주문 키, 요청 수량 2개",
          "when": "재고 차감 이후 주문 저장 실패를 유도한다.",
          "expectedOutcomes": [
            "새 주문은 0건이고 재고는 5개이다."
          ],
          "testTypes": [
            "INTEGRATION"
          ]
        },
        "SCN-KEY-CONFLICT": {
          "type": "DUPLICATE",
          "given": "동일 키로 수량 2개 주문이 성공했다.",
          "when": "동일 키로 수량 3개를 요청한다.",
          "expectedOutcomes": [
            "conflict로 거부한다.",
            "기존 주문과 재고는 변경하지 않는다."
          ],
          "testTypes": [
            "DOMAIN_UNIT",
            "INTEGRATION"
          ]
        }
      },
      "review": {
        "status": "INSUFFICIENT_EVIDENCE",
        "reason": "정의서의 성공/실패 계약은 정리했지만 키 보관 기간이 명시되지 않았다. 코드와 실행 결과는 검토하지 않았다.",
        "evidence": [
          {
            "kind": "REQUIREMENT",
            "path": "order-inventory.definition.md",
            "locator": "정상 처리와 불변 규칙; 중복 처리; 동시 처리; 실패 처리",
            "observation": "정의서의 기대 동작을 분석 산출물로 정리했다."
          }
        ],
        "openQuestions": [
          "멱등 키 보관 기간과 기간 만료 후 재전달 계약은 무엇인가?"
        ]
      }
    }
  }
}
